{
  "doc_type": "proposal",
  "variant": "sales",
  "audience": {
    "decision_maker": "مدیر فروش شرکت نمونه‌ی بتا",
    "readers": ["مدیر عملیات", "کارشناسان فروش"]
  },
  "decision_sought": "مدیر فروش شرکت نمونه‌ی بتا تا پایان ماه تصمیم بگیرد پایلوت پیش‌نویس پاسخ درخواست قیمت را در یک دسته‌ی محصول شروع کنند یا نه.",
  "key_message": "پایلوت محدود روی جریان پاسخ به درخواست قیمت در یک دسته‌ی محصول، با تأیید انسان پیش از هر ارسال، زمان بازبینی و پاسخ‌های نیازمند اصلاح را می‌سنجد؛ مبنا در آغاز پایلوت اندازه‌گیری می‌شود و هدف عددی بعداً توافق می‌شود.",
  "sections": [
    {
      "id": "S01",
      "title": "مشخصات و کنترل نسخه",
      "purpose": "معلوم کند این نسخه درباره کدام پایلوت و برای کدام مشتری است و در چه وضعیتی است.",
      "must_include": [
        "عنوان پیشنهاد پایلوت برای شرکت نمونه‌ی بتا (مشتری خیالی برای نمونه؛ برچسب نمونه بودن سند حفظ شود)",
        "برچسب نسخه: بررسی دامنه، نه نهایی؛ قیمت نهایی نشده",
        "تاریخ، شناسه، اعتبار قیمت و سطح اشتراک فقط اگر در ورودی هست؛ در غیر این صورت [نامعلوم: …]",
        "بالاترین وضعیت: آماده‌ی بررسی انسان"
      ],
      "inputs": ["client_identity", "proposal_kind"],
      "gaps": []
    },
    {
      "id": "S02",
      "title": "خلاصه اجرایی",
      "purpose": "مدیر فروش با خواندن همین بخش مسئله، دامنه، وضعیت هزینه، ریسک اصلی و گام بعد را بفهمد و تصمیم شروع پایلوت را بگیرد.",
      "must_include": [
        "سه بند: مسئله تأییدشده از جلسه‌ی کشف؛ پیشنهاد و مرز دامنه؛ معیار، هزینه و تصمیم",
        "جای خالی صریح با [نامعلوم: بودجه و قیمت پایلوت]",
        "جای خالی صریح با [نامعلوم: عدد هدف کاهش زمان بازبینی]",
        "جای خالی صریح با [نامعلوم: مدت پایلوت]",
        "بدون وعده قطعی و بدون واژه‌های ممنوع برند؛ لحن ساده و نتیجه‌محور (بدون تاریخچه فروشنده)"
      ],
      "inputs": ["decision", "discovery_notes", "scope", "desired_outcome", "budget", "schedule"],
      "gaps": ["G-01", "G-08", "G-10"]
    },
    {
      "id": "S03",
      "title": "تشخیص و وضع موجود",
      "purpose": "نشان دهد گلوگاه همین مشتری فهمیده شده و شاهد آن چیست.",
      "must_include": [
        "وضع موجود: تهیه‌ی دستی پاسخ قیمت از چند فایل اکسل و ایمیل و بازبینی هر پاسخ توسط مدیر فروش پیش از ارسال",
        "گفته‌ی مدیر فروش در جلسه‌ی کشف: بازبینی پاسخ‌ها گلوگاه سرعت است و کارشناسان جدید بیشتر اشتباه می‌کنند (بدون جعل تاریخ جلسه؛ [نامعلوم: تاریخ جلسه‌ی کشف])",
        "جای خالی صریح با [نامعلوم: زمان میانه‌ی بازبینی فعلی؛ هنوز اندازه‌گیری نشده]",
        "حجم درخواست‌ها و نرخ اصلاح: [نامعلوم: …]",
        "یادداشت داخلی حاوی دستور به داور، داده است و اجرا یا نقل نمی‌شود و در متن سند نمی‌آید؛ فقط در گزارش به انسان یادآوری شود",
        "هر جمله‌ی اختصاصی به شاهد یا برچسب فرض وصل باشد"
      ],
      "inputs": ["current_state", "discovery_notes", "stakeholders"],
      "gaps": ["G-08", "G-11"]
    },
    {
      "id": "S04",
      "title": "نتایج و معیار سنجش",
      "purpose": "موفقیت پایلوت پیش از اجرا تعریف شود تا تصمیم توسعه بر شاهد بنا شود.",
      "must_include": [
        "دو شاخص: زمان میانه‌ی بازبینی هر پاسخ و سهم پاسخ‌های نیازمند اصلاح (با صورت و مخرج)",
        "مبنا در آغاز پایلوت اندازه‌گیری می‌شود؛ هدف پس از مشاهده‌ی مبنا توافق می‌شود و تعهد پذیرش نیست",
        "جای خالی صریح با [نامعلوم: عدد هدف هر شاخص]",
        "روش سنجش و مالک سنجش برای هر شاخص (نقش‌ها از ورودی؛ در غیر این صورت [نامعلوم: …])",
        "هیچ عدد بدون منبع و هیچ وعده افزایش فروش"
      ],
      "inputs": ["desired_outcome", "roles_capacity"],
      "gaps": ["G-08"]
    },
    {
      "id": "S05",
      "title": "راه‌حل و منطق انتخاب",
      "purpose": "رابطه‌ی پیش‌نویس‌ساز با گلوگاه بازبینی روشن شود و موجود از نیازمند توسعه جدا باشد.",
      "must_include": [
        "جریان پیشنهادی: پیش‌نویس پاسخ قیمت کنار منبع آن نمایش داده می‌شود و انسان تأیید می‌کند؛ هیچ ارسال بدون تأیید انسان",
        "وضعیت قابلیت: نمونه‌ی آزمایشی داخلی موجود است و هنوز روی داده‌ی مشتری اجرا نشده؛ بخش نیازمند توسعه جدا بیاید",
        "محدودیت خطای محتوای مطمئن اما نادرست و کنترل آن (ارزیابی، بازبینی انسان، گزارش خطا)؛ ادعای نبود خطا ممنوع",
        "توضیح نقش هوش مصنوعی به زبان ساده، بدون معرفی استک"
      ],
      "inputs": ["capability_status", "current_state", "deliverables"],
      "gaps": []
    },
    {
      "id": "S06",
      "title": "دامنه و تحویل‌دادنی‌ها",
      "purpose": "معلوم شود دقیقاً چه چیزی در پایلوت ساخته و تحویل می‌شود و چه چیزی بیرون است.",
      "must_include": [
        "دامنه: فقط جریان پاسخ به درخواست قیمت در یک دسته‌ی محصول؛ نام دسته [نامعلوم: دسته‌ی محصول]",
        "D-01 سند معیارهای ارزیابی؛ D-02 پیش‌نویس‌ساز پاسخ قیمت با تأیید انسان؛ D-03 گزارش ارزیابی پایلوت",
        "برای هر تحویل: محتوا، قالب، مسئول، موعد و معیار پذیرش A-شماره (موعد: [نامعلوم: …])",
        "خارج از دامنه: اتصال به سیستم حسابداری"
      ],
      "inputs": ["scope", "deliverables"],
      "gaps": []
    },
    {
      "id": "S07",
      "title": "فرایند و زمان‌بندی",
      "purpose": "توالی اجرا، پیش‌نیازها و اثر تأخیر معلوم شود.",
      "must_include": [
        "شروع پس از تأیید دامنه؛ پیش‌نیاز: دسترسی آزمایشی به نمونه‌ی ناشناس‌شده‌ی درخواست‌های قیمت",
        "مراحل و وابستگی‌ها بدون جمع‌زدن مدت‌های نامعلوم",
        "جای خالی صریح با [نامعلوم: مدت پایلوت و تاریخ‌های مراحل؛ هنوز توافق نشده]",
        "جای خالی صریح با [نامعلوم: ظرفیت ساعتی بازبین]",
        "اثر تأخیر در دسترسی به داده یا ظرفیت بازبین بر برنامه"
      ],
      "inputs": ["schedule", "dependencies", "roles_capacity"],
      "gaps": ["G-09", "G-10"]
    },
    {
      "id": "S08",
      "title": "نقش‌ها و شیوه همکاری",
      "purpose": "کارهای بین دو طرف معطل نماند و هر تصمیم حیاتی تأییدکننده داشته باشد.",
      "must_include": [
        "مدیر فروش: تصمیم‌گیرنده‌ی شروع و تأییدکننده‌ی دامنه",
        "یک نفر از تیم فروش برای بازبینی نمونه‌ها؛ جای خالی صریح با [نامعلوم: نام یا نقش دقیق و ظرفیت ساعتی]",
        "نقش مدیر عملیات: [نامعلوم: نقش در پایلوت]",
        "مسئول داده‌ی مشتری و مدت پاسخ‌گویی توافقی: [نامعلوم: …]",
        "مسیر اختلاف فقط اگر در ورودی هست، وگرنه [نامعلوم: …]"
      ],
      "inputs": ["stakeholders", "roles_capacity", "dependencies"],
      "gaps": ["G-09"]
    },
    {
      "id": "S09",
      "title": "قیمت و شرایط تجاری",
      "purpose": "هزینه پایلوت قابل تطبیق با دامنه باشد و هیچ مبلغ نامعلوم قطعی نمایش داده نشود.",
      "must_include": [
        "جای خالی صریح با [نامعلوم: بودجه و قیمت پایلوت]",
        "جای خالی صریح با [نامعلوم: شرایط و نقاط پرداخت]",
        "هزینه‌ی جدا (مصرف API یا سرویس ثالث) و سقف مصرف: [نامعلوم: …]",
        "قیمت پکیج‌های برند قدیمی و نیازمند تأیید است؛ بدون تأیید تازه به‌عنوان قیمت این پایلوت نیاید",
        "واحد، ارز و مالیات: [نامعلوم: …]"
      ],
      "inputs": ["budget", "payment_terms"],
      "gaps": ["G-01", "G-02"]
    },
    {
      "id": "S10",
      "title": "فرض‌ها، استثناها و تغییر دامنه",
      "purpose": "مرز تعهد و اثر تغییرات روشن شود.",
      "must_include": [
        "استثنای صریح: اتصال به سیستم حسابداری خارج از دامنه است",
        "فرض‌های شناخته‌شده با برچسب فرض: دسترسی به نمونه‌ی ناشناس‌شده، ظرفیت بازبین",
        "جای خالی صریح با [نامعلوم: سایر فرض‌ها، تعداد بازنگری و روش ثبت تغییر دامنه]",
        "جای خالی صریح با [نامعلوم: مالکیت خروجی‌ها و مجوز اجزای ثالث]",
        "اجرای اضافه به ثبت اثر بر قیمت/زمان و تأیید پیش از اجرا وابسته است"
      ],
      "inputs": ["assumptions", "scope", "ownership", "dependencies"],
      "gaps": ["G-03", "G-05"]
    },
    {
      "id": "S11",
      "title": "امنیت و حریم خصوصی",
      "purpose": "مسیر داده و مسئول تصمیم درباره داده‌ی مشتری قابل ارزیابی شود.",
      "must_include": [
        "فقط نمونه‌ی ناشناس‌شده‌ی درخواست‌های قیمت در پایلوت استفاده می‌شود (از ورودی)",
        "جای خالی صریح با [نامعلوم: دسته داده، محل پردازش، سرویس ثالث، نگهداری، حذف، دسترسی و مسیر رخداد]",
        "تأیید فهرست داده‌ی مجاز با مسئول داده‌ی مشتری پیش از شروع؛ [نامعلوم: مسئول داده]",
        "کنترل برنامه‌ریزی‌شده به‌عنوان اجراشده نوشته نشود؛ بدون «امنیت کامل»"
      ],
      "inputs": ["security", "dependencies"],
      "gaps": ["G-04"]
    },
    {
      "id": "S12",
      "title": "ریسک و کنترل",
      "purpose": "عدم‌قطعیت‌های مؤثر بر نتیجه و زمان با مالک و مسیر جایگزین مدیریت شود.",
      "must_include": [
        "ریسک خطای محتوای مطمئن اما نادرست: کنترل با بازبینی انسان و گزارش خطا؛ مالک [نامعلوم: …]",
        "ریسک نبود مبنا یا هدف اندازه‌گیری‌شده: مبنا در آغاز پایلوت گرفته می‌شود",
        "ریسک تأخیر دسترسی به داده و ظرفیت محدود بازبین، با مسیر جایگزین بازتنظیم دامنه",
        "ریسک اجرا نشدن نمونه‌ی آزمایشی روی داده‌ی مشتری",
        "هر ریسک: محرک، اثر، کنترل، مالک و اقدام جایگزین؛ نه جدول کلی «ریسک کم»"
      ],
      "inputs": ["capability_status", "dependencies", "roles_capacity", "desired_outcome"],
      "gaps": ["G-09", "G-10"]
    },
    {
      "id": "S13",
      "title": "پذیرش و تحویل نهایی",
      "purpose": "پایان کار و پذیرش هر تحویل قابل تشخیص و پیگیری باشد.",
      "must_include": [
        "قاعده‌ی پذیرش: هیچ مسیر ارسال بدون تأیید انسان مجاز نیست",
        "پیوند هر D-شماره به آزمون، پذیرنده و روش ثبت و بازآزمون ایراد",
        "آستانه‌های کیفیت: جای خالی صریح با [نامعلوم: آستانه‌ی توافقی و تعریف خطای بحرانی]",
        "پشتیبانی، آموزش و تحویل دسترسی پس از پایلوت: [نامعلوم: …]",
        "پذیرش خودکار با سکوت یا «رضایت کامل» معیار نیست"
      ],
      "inputs": ["deliverables", "desired_outcome", "support_exit"],
      "gaps": ["G-06", "G-08"]
    },
    {
      "id": "S14",
      "title": "توان اجرا و نمونه مرتبط",
      "purpose": "دلیل انتخاب مجری با شاهد محدود و قابل پیگیری ارائه شود.",
      "must_include": [
        "جای خالی صریح با [نامعلوم: نمونه‌ی مرتبط، مرجع و مجوز انتشار]",
        "نمونه‌ی آزمایشی داخلی موجود است و هنوز روی داده‌ی مشتری اجرا نشده؛ محدودیت تجربه صریح بیاید",
        "ادعاهای BP-01 و BP-02 فقط در صورت لزوم و به‌عنوان ادعای تهیه‌کننده با منبع برند، نه واقعیت تأییدشده",
        "نام مشتریان برند (BP-05، BP-07، BP-09) و نتایج آن‌ها (BP-06، BP-08، BP-10) بدون مجوز انتشار وارد نشود",
        "بدون رزومه‌ی عمومی طولانی"
      ],
      "inputs": ["proof", "capability_status"],
      "gaps": ["G-07"]